{
  "schema_version": "1.0.0",
  "household_id": "hh_sus_001",
  "name": "Sustainability Fixture Household",
  "province_or_territory": "ON",
  "people": [
    {
      "person_id": "p_sus_001",
      "display_name": "Alex Green",
      "birth_year": 1987,
      "retirement_target_age": 65
    }
  ],
  "accounts": [
    {
      "account_id": "acc_tfsa",
      "account_type": "tfsa",
      "ownership": "individual",
      "currency": "CAD",
      "current_balance": 110000,
      "annual_contribution": 7000,
      "last_updated": "2026-03-08"
    },
    {
      "account_id": "acc_rrsp",
      "account_type": "rrsp",
      "ownership": "individual",
      "currency": "CAD",
      "current_balance": 220000,
      "annual_contribution": 12000,
      "last_updated": "2026-03-08"
    },
    {
      "account_id": "acc_nonreg",
      "account_type": "non_registered",
      "ownership": "individual",
      "currency": "CAD",
      "current_balance": 65000,
      "annual_contribution": 5000,
      "last_updated": "2026-03-08"
    }
  ],
  "goals": [],
  "assumptions": {
    "inflation_rate": 0.02,
    "expected_return": 0.05,
    "tax_year": 2026,
    "cpp_start_age_options": [65, 70],
    "oas_start_age_options": [65, 70]
  },
  "sustainability_preferences": {
    "exclusions": ["fossil_fuel_producers"],
    "priorities": {
      "fossil_exposure": 5,
      "carbon_intensity": 5,
      "renewable_transition": 4,
      "social_community": 3,
      "controversial_sector": 4
    },
    "tradeoff_tolerance": "medium",
    "local_investment_preference": true,
    "indigenous_rights_consideration": true
  },
  "updated_at": "2026-03-08T22:30:00Z"
}
